{
  "$schema": "https://json-schema.org/draft/2020-12/schema",
  "$id": "https://agentbridge.dev/spec/agentbridge-manifest.v0.1.schema.json",
  "title": "AgentBridge Manifest",
  "description": "Machine-readable description of structured actions a web app exposes to AI agents. Served at /.well-known/agentbridge.json.",
  "type": "object",
  "required": ["name", "version", "baseUrl"],
  "additionalProperties": true,
  "properties": {
    "name": {
      "type": "string",
      "minLength": 1,
      "description": "Human-readable name of the AgentBridge surface (the app or product)."
    },
    "description": {
      "type": "string",
      "description": "One-paragraph summary of what this surface lets agents do."
    },
    "version": {
      "type": "string",
      "minLength": 1,
      "description": "Semver version of the manifest. Bump on action additions, removals, or schema changes."
    },
    "baseUrl": {
      "type": "string",
      "format": "uri",
      "description": "Canonical origin agents should call for actions. All action endpoints must share this origin."
    },
    "contact": {
      "type": "string",
      "description": "Email or URL for the manifest publisher."
    },
    "auth": {
      "type": "object",
      "required": ["type"],
      "description": "How agents authenticate to this surface.",
      "properties": {
        "type": {
          "type": "string",
          "enum": ["none", "bearer", "oauth2", "api_key"]
        },
        "description": { "type": "string" }
      }
    },
    "resources": {
      "type": "array",
      "description": "Conceptual data resources actions touch (orders, customers, tickets, etc.). Documentation, not enforcement.",
      "items": { "$ref": "#/$defs/Resource" }
    },
    "actions": {
      "type": "array",
      "description": "Structured operations agents can invoke.",
      "items": { "$ref": "#/$defs/Action" }
    },
    "generatedAt": {
      "type": "string",
      "format": "date-time",
      "description": "Optional ISO timestamp of when the manifest was last generated."
    }
  },
  "$defs": {
    "Resource": {
      "type": "object",
      "required": ["name"],
      "properties": {
        "name": { "type": "string", "minLength": 1 },
        "description": { "type": "string" },
        "url": { "type": "string" }
      }
    },
    "PermissionPolicy": {
      "type": "object",
      "required": ["scope"],
      "properties": {
        "scope": {
          "type": "string",
          "description": "Free-form scope identifier the agent must hold to call this action (e.g. orders:write)."
        },
        "description": { "type": "string" }
      }
    },
    "ActionExample": {
      "type": "object",
      "required": ["input"],
      "properties": {
        "description": { "type": "string" },
        "input": { "type": "object" },
        "output": { "type": "object" }
      }
    },
    "Action": {
      "type": "object",
      "required": [
        "name",
        "title",
        "description",
        "inputSchema",
        "method",
        "endpoint",
        "risk",
        "requiresConfirmation"
      ],
      "additionalProperties": true,
      "properties": {
        "name": {
          "type": "string",
          "minLength": 1,
          "pattern": "^[a-z][a-z0-9_]*$",
          "description": "Stable machine identifier. snake_case. Treat as part of your public API."
        },
        "title": {
          "type": "string",
          "minLength": 1,
          "description": "Short human-readable title."
        },
        "description": {
          "type": "string",
          "minLength": 1,
          "description": "Agent-friendly description: WHEN should an agent call this?"
        },
        "inputSchema": {
          "type": "object",
          "description": "JSON Schema describing the action's input. Should be type: object with explicit properties."
        },
        "outputSchema": {
          "type": "object",
          "description": "JSON Schema describing the action's output. Optional but strongly encouraged."
        },
        "method": {
          "type": "string",
          "enum": ["GET", "POST", "PUT", "PATCH", "DELETE"],
          "description": "HTTP method the action uses."
        },
        "endpoint": {
          "type": "string",
          "minLength": 1,
          "description": "Path under baseUrl where this action is invoked, e.g. /api/agentbridge/actions/refund_order."
        },
        "risk": {
          "type": "string",
          "enum": ["low", "medium", "high"],
          "description": "Risk classification. low = read-only/safe. medium = mutates app state. high = irreversible or financially significant."
        },
        "requiresConfirmation": {
          "type": "boolean",
          "description": "If true, agents (or the MCP layer) must obtain explicit human approval before calling."
        },
        "permissions": {
          "type": "array",
          "items": { "$ref": "#/$defs/PermissionPolicy" }
        },
        "examples": {
          "type": "array",
          "items": { "$ref": "#/$defs/ActionExample" }
        },
        "humanReadableSummaryTemplate": {
          "type": "string",
          "description": "Template with {{key}} placeholders. Used to render natural-language confirmation prompts."
        }
      }
    }
  }
}
